{
  "schema_version": "v1",
  "response_type": "source_catalog_item",
  "request_id": "99999999-9999-4999-8999-999999999999",
  "tenant_id": "11111111-1111-4111-8111-111111111111",
  "source": {
    "source_id": "12121212-1212-4121-8121-121212121212",
    "source_key": "mixco-procedure-manual-discovery",
    "title": "Manual de procedimientos de referencia",
    "category": "procedure_manual",
    "target_jurisdiction": "Municipio de La Antigua Guatemala, Sacatepequez, Guatemala",
    "source_jurisdiction": "Municipio de Mixco, Guatemala",
    "source_relation": "comparative",
    "discovery_status": "identified",
    "discovery_url": "https://www2.munimixco.gob.gt/documentos/manual.pdf",
    "artifact_url": null,
    "observed_version": "discovery-2026-07",
    "publication_date": null,
    "effective_date": null,
    "limitations": [
      "Vigencia y aplicabilidad pendientes de revision.",
      "Referencia comparativa de otra municipalidad. No define por sí sola el procedimiento oficial de La Antigua Guatemala. Requiere corroboración con fuente nacional o de La Antigua Guatemala."
    ],
    "validation_state": "unreviewed",
    "official_source": false,
    "official_for_target_jurisdiction": false,
    "acquisition_state": "not_acquired",
    "ingestion_state": "not_ingested",
    "retrieval_state": "not_indexed",
    "created_by_principal_id": "33333333-3333-4333-8333-333333333333",
    "created_at": "2026-07-21T23:00:00.000Z",
    "updated_at": "2026-07-21T23:00:00.000Z"
  },
  "provenance": {
    "source_product": "la_muni_rag",
    "generated_by": "system",
    "created_at": "2026-07-21T23:00:00.000Z",
    "source_refs": [
      "12121212-1212-4121-8121-121212121212"
    ],
    "credential_id": "66666666-6666-4666-8666-666666666666",
    "audit_id": "abababab-abab-4bab-8bab-abababababab"
  }
}
